{
  "qa_id": "QA_20260320_112603_683f7713",
  "timestamp": "2026-03-20T17:26:03.271562+00:00",
  "status": "healthy",
  "source_storyboard": "STORYBOARD_20260320_112412_06ac0d10",
  "qa_reports": [
    {
      "script_id": "SCR_74ac4c746b97",
      "checks": [
        {
          "check_id": "CHK_74ac4c74_001",
          "check_type": "asset_coverage",
          "target": "SCR_74ac4c746b97",
          "result": "pass",
          "message": "All required asset types present",
          "details": {}
        },
        {
          "check_id": "CHK_74ac4c74_002",
          "check_type": "scene_mapping",
          "target": "SCR_74ac4c746b97",
          "result": "pass",
          "message": "All 14 frames have valid scene mappings",
          "details": {
            "frame_count": 14
          }
        },
        {
          "check_id": "CHK_74ac4c74_003",
          "check_type": "prompt_length",
          "target": "ASSET_74ac4c74_thumbnail_00_ba83b591",
          "result": "pass",
          "message": "Prompt length OK (200 chars)",
          "details": {
            "length": 200
          }
        },
        {
          "check_id": "CHK_74ac4c74_004",
          "check_type": "content_policy",
          "target": "ASSET_74ac4c74_thumbnail_00_ba83b591",
          "result": "pass",
          "message": "No disallowed words found",
          "details": {}
        },
        {
          "check_id": "CHK_74ac4c74_005",
          "check_type": "prompt_length",
          "target": "ASSET_74ac4c74_intro_card_00_94118ca8",
          "result": "pass",
          "message": "Prompt length OK (177 chars)",
          "details": {
            "length": 177
          }
        },
        {
          "check_id": "CHK_74ac4c74_006",
          "check_type": "content_policy",
          "target": "ASSET_74ac4c74_intro_card_00_94118ca8",
          "result": "pass",
          "message": "No disallowed words found",
          "details": {}
        },
        {
          "check_id": "CHK_74ac4c74_007",
          "check_type": "prompt_length",
          "target": "ASSET_74ac4c74_lower_third_00_ef287e54",
          "result": "pass",
          "message": "Prompt length OK (147 chars)",
          "details": {
            "length": 147
          }
        },
        {
          "check_id": "CHK_74ac4c74_008",
          "check_type": "content_policy",
          "target": "ASSET_74ac4c74_lower_third_00_ef287e54",
          "result": "pass",
          "message": "No disallowed words found",
          "details": {}
        },
        {
          "check_id": "CHK_74ac4c74_009",
          "check_type": "prompt_length",
          "target": "ASSET_74ac4c74_lower_third_01_12b9bd5e",
          "result": "pass",
          "message": "Prompt length OK (153 chars)",
          "details": {
            "length": 153
          }
        },
        {
          "check_id": "CHK_74ac4c74_010",
          "check_type": "content_policy",
          "target": "ASSET_74ac4c74_lower_third_01_12b9bd5e",
          "result": "pass",
          "message": "No disallowed words found",
          "details": {}
        },
        {
          "check_id": "CHK_74ac4c74_011",
          "check_type": "prompt_length",
          "target": "ASSET_74ac4c74_lower_third_02_e52e2fc4",
          "result": "pass",
          "message": "Prompt length OK (153 chars)",
          "details": {
            "length": 153
          }
        },
        {
          "check_id": "CHK_74ac4c74_012",
          "check_type": "content_policy",
          "target": "ASSET_74ac4c74_lower_third_02_e52e2fc4",
          "result": "pass",
          "message": "No disallowed words found",
          "details": {}
        },
        {
          "check_id": "CHK_74ac4c74_013",
          "check_type": "timecode_format",
          "target": "FRAME_74ac4c74_001",
          "result": "pass",
          "message": "Valid timecode format: 00:00:00:00",
          "details": {}
        },
        {
          "check_id": "CHK_74ac4c74_014",
          "check_type": "timecode_format",
          "target": "FRAME_74ac4c74_002",
          "result": "pass",
          "message": "Valid timecode format: 00:00:03:00",
          "details": {}
        },
        {
          "check_id": "CHK_74ac4c74_015",
          "check_type": "timecode_format",
          "target": "FRAME_74ac4c74_003",
          "result": "pass",
          "message": "Valid timecode format: 00:00:06:00",
          "details": {}
        }
      ],
      "passed": 15,
      "failed": 0,
      "warnings": 0,
      "gate_status": "approved"
    },
    {
      "script_id": "SCR_a8bc4e18f00d",
      "checks": [
        {
          "check_id": "CHK_a8bc4e18_001",
          "check_type": "asset_coverage",
          "target": "SCR_a8bc4e18f00d",
          "result": "pass",
          "message": "All required asset types present",
          "details": {}
        },
        {
          "check_id": "CHK_a8bc4e18_002",
          "check_type": "scene_mapping",
          "target": "SCR_a8bc4e18f00d",
          "result": "pass",
          "message": "All 14 frames have valid scene mappings",
          "details": {
            "frame_count": 14
          }
        },
        {
          "check_id": "CHK_a8bc4e18_003",
          "check_type": "prompt_length",
          "target": "ASSET_a8bc4e18_thumbnail_00_54139b5f",
          "result": "pass",
          "message": "Prompt length OK (204 chars)",
          "details": {
            "length": 204
          }
        },
        {
          "check_id": "CHK_a8bc4e18_004",
          "check_type": "content_policy",
          "target": "ASSET_a8bc4e18_thumbnail_00_54139b5f",
          "result": "pass",
          "message": "No disallowed words found",
          "details": {}
        },
        {
          "check_id": "CHK_a8bc4e18_005",
          "check_type": "prompt_length",
          "target": "ASSET_a8bc4e18_intro_card_00_20a9169f",
          "result": "pass",
          "message": "Prompt length OK (181 chars)",
          "details": {
            "length": 181
          }
        },
        {
          "check_id": "CHK_a8bc4e18_006",
          "check_type": "content_policy",
          "target": "ASSET_a8bc4e18_intro_card_00_20a9169f",
          "result": "pass",
          "message": "No disallowed words found",
          "details": {}
        },
        {
          "check_id": "CHK_a8bc4e18_007",
          "check_type": "prompt_length",
          "target": "ASSET_a8bc4e18_lower_third_00_801e18a5",
          "result": "pass",
          "message": "Prompt length OK (147 chars)",
          "details": {
            "length": 147
          }
        },
        {
          "check_id": "CHK_a8bc4e18_008",
          "check_type": "content_policy",
          "target": "ASSET_a8bc4e18_lower_third_00_801e18a5",
          "result": "pass",
          "message": "No disallowed words found",
          "details": {}
        },
        {
          "check_id": "CHK_a8bc4e18_009",
          "check_type": "prompt_length",
          "target": "ASSET_a8bc4e18_lower_third_01_c69ab782",
          "result": "pass",
          "message": "Prompt length OK (153 chars)",
          "details": {
            "length": 153
          }
        },
        {
          "check_id": "CHK_a8bc4e18_010",
          "check_type": "content_policy",
          "target": "ASSET_a8bc4e18_lower_third_01_c69ab782",
          "result": "pass",
          "message": "No disallowed words found",
          "details": {}
        },
        {
          "check_id": "CHK_a8bc4e18_011",
          "check_type": "prompt_length",
          "target": "ASSET_a8bc4e18_lower_third_02_066fec5f",
          "result": "pass",
          "message": "Prompt length OK (153 chars)",
          "details": {
            "length": 153
          }
        },
        {
          "check_id": "CHK_a8bc4e18_012",
          "check_type": "content_policy",
          "target": "ASSET_a8bc4e18_lower_third_02_066fec5f",
          "result": "pass",
          "message": "No disallowed words found",
          "details": {}
        },
        {
          "check_id": "CHK_a8bc4e18_013",
          "check_type": "timecode_format",
          "target": "FRAME_a8bc4e18_001",
          "result": "pass",
          "message": "Valid timecode format: 00:00:00:00",
          "details": {}
        },
        {
          "check_id": "CHK_a8bc4e18_014",
          "check_type": "timecode_format",
          "target": "FRAME_a8bc4e18_002",
          "result": "pass",
          "message": "Valid timecode format: 00:00:03:00",
          "details": {}
        },
        {
          "check_id": "CHK_a8bc4e18_015",
          "check_type": "timecode_format",
          "target": "FRAME_a8bc4e18_003",
          "result": "pass",
          "message": "Valid timecode format: 00:00:06:00",
          "details": {}
        }
      ],
      "passed": 15,
      "failed": 0,
      "warnings": 0,
      "gate_status": "approved"
    },
    {
      "script_id": "SCR_6bea7c64fbea",
      "checks": [
        {
          "check_id": "CHK_6bea7c64_001",
          "check_type": "asset_coverage",
          "target": "SCR_6bea7c64fbea",
          "result": "pass",
          "message": "All required asset types present",
          "details": {}
        },
        {
          "check_id": "CHK_6bea7c64_002",
          "check_type": "scene_mapping",
          "target": "SCR_6bea7c64fbea",
          "result": "pass",
          "message": "All 14 frames have valid scene mappings",
          "details": {
            "frame_count": 14
          }
        },
        {
          "check_id": "CHK_6bea7c64_003",
          "check_type": "prompt_length",
          "target": "ASSET_6bea7c64_thumbnail_00_43f3f349",
          "result": "pass",
          "message": "Prompt length OK (204 chars)",
          "details": {
            "length": 204
          }
        },
        {
          "check_id": "CHK_6bea7c64_004",
          "check_type": "content_policy",